disease,description,home_remedies,medicine_category,consult_if,severity
gonorrhea,Sexually transmitted bacterial infection causing genital discharge and pain.,Safe sex · Partner treatment · Hydration · Avoid sexual activity until treated,Ceftriaxone injection · Azithromycin · Doxycycline · Partner treatment mandatory,Always requires prescription treatment and partner notification,moderate
ectopic pregnancy,Fertilized egg implants outside uterus — a medical emergency.,Seek emergency care immediately,Methotrexate · Surgical removal — emergency intervention,Immediately — ectopic pregnancy can be fatal without treatment,severe
carpal tunnel syndrome,Compression of median nerve at wrist causing hand numbness and weakness.,Wrist splint · Rest · Ice · Ergonomic keyboard · Wrist stretches,NSAIDs · Corticosteroid injections · Carpal tunnel release surgery,"Constant numbness, thenar muscle wasting, or grip weakness",mild
kidney stone,Hard mineral deposits in kidneys causing severe colicky flank pain.,Drink 3 litres water daily · Lemon juice · Avoid oxalate rich foods · Low sodium diet,NSAIDs · Alpha blockers · Lithotripsy · Ureteroscopy for large stones,"Pain uncontrolled, fever with pain, or complete inability to urinate",severe
autism,"Neurodevelopmental condition affecting communication, behavior and social interaction.",Structured routine · Sensory-friendly environment · ABA therapy · Social skills training,Risperidone · Aripiprazole · Melatonin · SSRIs · Speech and occupational therapy,"Regression in skills, self-harm, or safety concerns",moderate
aplastic anemia,Bone marrow failure causing severely reduced production of all blood cells.,Infection prevention · Avoid bleeding risks · Nutritional support · Rest,Immunosuppressants · Growth factors · Bone marrow transplant · Transfusions,Always requires immediate hematology specialist care,severe
syphilis,Sexually transmitted bacterial infection causing staged disease affecting multiple organs.,Safe sex · Avoid sexual contact until treated · Partner notification,Penicillin G · Doxycycline · Azithromycin · Partner treatment,Any suspected syphilis requires immediate testing and treatment,severe
drug withdrawal,Physical and psychological symptoms from stopping addictive substances.,Gradual tapering · Hydration · Nutritional support · Support groups · Therapy,Methadone · Buprenorphine · Clonidine · Benzodiazepines · Naltrexone,"Seizures, severe agitation, hallucinations, or cardiac symptoms",severe
hypercholesterolemia,Elevated blood cholesterol levels increasing risk of heart disease.,Low saturated fat diet · Regular exercise · Avoid trans fats · Increase fiber · Omega-3,Statins · Ezetimibe · PCSK9 inhibitors · Bile acid sequestrants · Fibrates,"Chest pain, known heart disease, or very high cholesterol above 300",moderate
kidney failure,Complete loss of kidney function requiring dialysis or transplant.,Strict fluid restriction · Low potassium and phosphorus diet · Salt restriction,Dialysis · Erythropoietin · Phosphate binders · Kidney transplant,Always requires immediate nephrologist care,severe
muscle spasm,Sudden involuntary contraction of muscle causing pain and tightness.,Gentle stretching · Heat or ice · Massage · Hydration · Magnesium-rich foods,Muscle relaxants · NSAIDs · Topical analgesics · Magnesium supplements,"Severe persistent spasms, associated weakness, or after injury",mild
hemophilia,Inherited bleeding disorder from deficient clotting factors causing prolonged bleeding.,Avoid aspirin and NSAIDs · Protective gear · First aid for cuts · Medic alert bracelet,Factor replacement therapy · Desmopressin · Antifibrinolytics · Gene therapy,"Any significant bleeding, head injury, or joint hemorrhage",severe
peritonsillar abscess,Collection of pus near tonsil causing severe sore throat and difficulty opening mouth.,Salt water gargle · Cold fluids · Rest · Analgesics,Antibiotics · Needle aspiration · Surgical drainage · Tonsillectomy,"Difficulty breathing, severe drooling, or muffled voice",severe
gastroparesis,"Delayed stomach emptying causing nausea, vomiting and feeling full quickly.",Small frequent low-fat meals · Avoid high fiber · Liquid nutrition · Walk after meals,Prokinetics · Antiemetics · Domperidone · Gastric electrical stimulation,"Severe vomiting, significant weight loss, or blood sugar instability",moderate
thrombocytopenia,"Low platelet count causing easy bruising, petechiae and bleeding risk.",Avoid aspirin and NSAIDs · Protective measures · Soft toothbrush · Soft foods,Corticosteroids · IVIG · Rituximab · Platelet transfusion · Splenectomy,"Active bleeding, platelet count below 20000, or head injury",severe
goiter,Abnormal enlargement of thyroid gland causing visible neck swelling.,Adequate iodine intake · Selenium-rich foods · Avoid excessive soy · Monitor thyroid,Levothyroxine · Antithyroid drugs · Radioactive iodine · Surgical thyroidectomy,"Difficulty swallowing, breathing problems, or rapidly growing goiter",moderate
muscular dystrophy,Genetic diseases causing progressive muscle weakness and degeneration.,Physical therapy · Assistive devices · Respiratory support · Nutritional care,Corticosteroids · Exon-skipping therapy · Respiratory support · Physiotherapy,"Respiratory difficulty, swallowing problems, or rapid motor decline",severe
scarlet fever,Bacterial infection with strep throat and characteristic red rash.,Rest · Cool fluids · Oatmeal bath for rash · Salt water gargle,Antibiotics (penicillin or amoxicillin) · Antipyretics · Analgesics,"Difficulty breathing, rash spreading, or kidney complications",moderate
polycystic ovarian syndrome (pcos),"Hormonal disorder causing irregular periods, excess androgens and polycystic ovaries.",Low glycemic diet · Regular exercise · Weight management · Spearmint tea · Cinnamon,Combined oral contraceptives · Metformin · Spironolactone · Clomiphene,"Severe period problems, difficulty conceiving, or signs of diabetes",moderate
encephalitis,Inflammation of the brain usually from viral infection causing confusion and seizures.,Seek emergency care immediately,Antiviral medications · Corticosteroids · Anticonvulsants · ICU supportive care,Immediately — encephalitis is a life-threatening medical emergency,severe
optic neuritis,Inflammation of optic nerve causing pain and temporary vision loss.,Rest · Avoid overheating · Reduce stress · Monitor vision,IV methylprednisolone · Oral steroids · Disease-modifying therapy if MS-related,Any sudden vision loss or eye pain — urgent ophthalmology evaluation,severe
alcohol withdrawal,Dangerous syndrome from stopping heavy alcohol use causing tremors and seizures.,Medical supervision required · Hydration · Nutritional support · Safe environment,Benzodiazepines · Thiamine · Anticonvulsants · Clonidine · Naltrexone,"Seizures, hallucinations, or severe confusion — medical emergency",severe
hemiplegia,Paralysis affecting one entire side of the body from brain or spinal injury.,Physiotherapy · Occupational therapy · Speech therapy · Assistive devices,Anticoagulants · Antispasticity drugs · Botulinum toxin · Rehabilitation,"Worsening paralysis, swallowing difficulty, or pressure sore infection",severe
meningioma,Usually benign tumor arising from meninges surrounding brain and spinal cord.,Regular monitoring as per specialist · Manage headache · Seizure precautions,Observation · Corticosteroids · Surgical resection · Stereotactic radiosurgery,"Worsening headaches, new seizures, or progressive neurological symptoms",severe
brain cancer,"Malignant tumor in brain tissue causing headaches, seizures and neurological deficits.",Seek specialist care immediately — nutritional support · Seizure safety,Surgery · Radiation · Chemotherapy · Targeted therapy · Palliative care,Always requires immediate neuro-oncology evaluation,severe
seasonal allergies (hay fever),"Allergic reaction to pollen causing sneezing, runny nose and itchy eyes.",Avoid peak pollen times · Air purifier · Saline nasal rinse · Local honey · Shower after outdoors,Antihistamines · Nasal corticosteroids · Decongestants · Immunotherapy,Symptoms not controlled with OTC medications or associated with asthma,mild
lung cancer,"Malignant tumor in lung tissue causing cough, weight loss and breathing problems.",Seek specialist care immediately — nutritional support · Quit smoking,Surgery · Chemotherapy · Radiation · Targeted therapy · Immunotherapy,Always requires immediate pulmonology or oncology evaluation,severe
psoriasis,Autoimmune skin condition causing rapid skin cell buildup forming red scaly patches.,Moisturize regularly · Sunlight exposure · Stress management · Aloe vera · Dead sea salt bath,Topical steroids · Vitamin D analogs · Methotrexate · Biologics · Cyclosporine,"Joint involvement, large body surface area, or rapid worsening",moderate
dislocation of the shoulder,Shoulder ball pops out of socket causing severe pain and deformity.,Immobilize arm in sling · Ice pack · Seek immediate care for reduction,Analgesics · Muscle relaxants · Closed reduction · Physical therapy · Surgery,Any suspected dislocation requires immediate medical reduction,moderate
osteoporosis,Reduced bone density increasing fracture risk especially in hips and spine.,Weight-bearing exercise · Calcium-rich diet · Vitamin D · Quit smoking · Avoid alcohol,Bisphosphonates · Denosumab · Teriparatide · Calcium and vitamin D supplements,"Fracture with minimal trauma, severe back pain, or height loss",moderate
sickle cell crisis,Painful vaso-occlusive episode from sickle cell anemia causing severe bone pain.,Hydration · Warmth · Gentle exercise · Avoid cold and dehydration · Folic acid,Analgesics · IV fluids · Hydroxyurea · Blood transfusion · Oxygen therapy,"Severe pain uncontrolled at home, fever, or breathing difficulty",severe
prostatitis,Inflammation of the prostate gland causing pelvic pain and urinary symptoms.,Warm sitz bath · Avoid caffeine and alcohol · Plenty of fluids · Avoid long sitting,Antibiotics · Alpha blockers · NSAIDs · Muscle relaxants · Prostate massage,"Fever with urinary symptoms, inability to urinate, or severe pain",moderate
vitamin d deficiency,"Insufficient vitamin D causing bone pain, muscle weakness and immune dysfunction.",Sunlight 15-30 minutes daily · Fortified foods · Fatty fish · Eggs · Mushrooms,Vitamin D3 supplements · Calcium supplements · Multivitamins · Weekly high-dose D3,"Severe bone pain, stress fractures, or blood level below 10 ng/mL",mild
tuberculosis,Serious airborne bacterial lung infection requiring 6-month treatment.,Adequate nutrition · Ventilate living spaces · Sunlight · DOTS compliance · Mask use,Rifampicin · Isoniazid · Pyrazinamide · Ethambutol — 6-month DOTS regimen,Always — TB requires mandatory supervised prescription treatment,severe
acute bronchitis,Short-term bronchial tube inflammation usually from infection causing cough.,Rest · Steam inhalation · Honey lemon tea · Hydration · Elevate head during sleep,Bronchodilators · Expectorants · Cough suppressants · Antibiotics only if bacterial,"Fever above 38.5°C, breathlessness, or cough lasting beyond 3 weeks",mild
myocarditis,Inflammation of heart muscle usually from viral infection causing chest pain.,Strict rest · Avoid strenuous activity · Heart-healthy diet · Regular monitoring,Diuretics · ACE inhibitors · Beta blockers · IVIG · Immunosuppressants,"Chest pain, breathlessness at rest, fainting, or irregular heartbeat",severe
preeclampsia,Pregnancy complication with high blood pressure and organ damage.,Rest · Low salt diet · Monitor blood pressure at home · Regular antenatal visits,Antihypertensives · Magnesium sulfate · Corticosteroids · Delivery of baby,"Severe headache, vision changes, or swelling during pregnancy — emergency",severe
ischemic heart disease,Reduced blood flow to heart muscle from coronary artery narrowing.,Heart-healthy diet · Regular exercise · Quit smoking · Stress management,Aspirin · Statins · Beta blockers · Nitrates · ACE inhibitors · Angioplasty,"Chest pain on exertion, breathlessness, or jaw and arm pain",severe
chickenpox,Highly contagious viral infection causing itchy blister rash and fever.,Oatmeal bath · Calamine lotion · Trim nails · Neem leaves · Cool compress,Antihistamines · Paracetamol · Acyclovir for high-risk cases · Calamine lotion,"Bacterial skin infection, high persistent fever, breathing difficulty, or immunocompromised",mild
croup,Viral respiratory infection causing barking cough and breathing difficulty in children.,Cool mist humidifier · Calm child · Cool night air · Upright position · Hydration,Dexamethasone · Nebulized epinephrine · Oxygen · Supportive care,"Stridor at rest, severe breathing difficulty, or cyanosis",moderate
lyme disease,Tick-borne bacterial infection causing rash and flu-like illness.,Remove tick promptly · Rest · Stay hydrated · Monitor for bull's eye rash · Tick prevention,Doxycycline · Amoxicillin · Cefuroxime — all require prescription,"Bull's eye rash, joint pain, neurological symptoms, or heart problems",moderate
acne,"Skin condition causing pimples, blackheads and whiteheads from clogged pores.",Gentle face wash · Non-comedogenic moisturizer · Avoid touching face · Tea tree oil,Benzoyl peroxide · Salicylic acid · Retinoids · Antibiotics for moderate-severe,"Severe cystic acne, scarring, or no response to OTC treatment",mild
depression,"Persistent low mood, loss of interest and energy affecting daily functioning.",Regular exercise · Social support · Sunlight exposure · Sleep hygiene · Therapy,SSRIs · SNRIs · Tricyclics · Bupropion · Mirtazapine,Suicidal ideation or complete inability to function,moderate
irritable bowel syndrome,"Functional bowel disorder causing abdominal pain, bloating and altered stools.",High fiber diet · Stress management · Regular meals · Peppermint tea · Probiotics,Antispasmodics · Laxatives · Loperamide · Low-dose antidepressants · Rifaximin,"Blood in stool, weight loss, or symptoms starting after age 50",mild
ovarian cyst,Fluid-filled sac on ovary causing pelvic pain or discovered incidentally.,Heat pad for pain · Hydration · Regular monitoring · Low impact exercise,NSAIDs · Hormonal contraceptives · Surgical cystectomy for large or complex cysts,"Sudden severe pelvic pain, fever, vomiting, or cyst rupture signs",mild
chlamydia,Most common bacterial STI causing genital discharge and burning urination.,Safe sex · Avoid sexual contact until treated · Partner notification and treatment,Azithromycin · Doxycycline · Partner treatment mandatory,Always requires prescription treatment and sexual partner notification,moderate
rheumatoid arthritis,Chronic autoimmune disease causing symmetric joint inflammation and deformity.,Warm compresses · Gentle exercise · Fish oil · Turmeric · Weight management,DMARDs · NSAIDs · Corticosteroids · Biologics (TNF inhibitors) · JAK inhibitors,"Sudden joint swelling, fever, or rapid loss of joint function",moderate
impetigo,Highly contagious bacterial skin infection causing honey-colored crusted sores.,Keep area clean · Dilute bleach soaks · Separate towels and linens · Trim nails,Topical mupirocin · Oral antibiotics · Antiseptic wash · Proper wound care,"Spreading infection, fever, or involvement of large areas",mild
migraine,"Severe recurrent headache with nausea, vomiting and light sensitivity.",Dark quiet room · Cold pack · Peppermint oil on temples · Hydration,Triptans · NSAIDs · Antiemetics · Ergotamines · Preventive beta blockers,"Headache lasting over 72 hours, vision loss, or worst headache ever",moderate
gestational diabetes,Diabetes developing during pregnancy affecting mother and baby health.,Low glycemic diet · Regular walking · Monitor blood sugar · Adequate sleep,Metformin · Insulin · Dietary management · Regular monitoring,Always requires obstetric and endocrinology management during pregnancy,moderate
multiple myeloma,Cancer of plasma cells in bone marrow causing bone pain and immune weakness.,Seek specialist care immediately — infection prevention · Adequate nutrition,Bortezomib · Thalidomide · Lenalidomide · Stem cell transplant · Bisphosphonates,Always requires immediate hematology oncology specialist care,severe
malaria,"Mosquito-borne parasitic infection causing cyclical fever, chills and sweats.",Rest · ORS · Cool compresses for fever · Mosquito net and repellent,Artemisinin combination therapy · Chloroquine · Primaquine · Quinine,Immediately — malaria requires prescription antimalarials,severe
schizophrenia,"Serious mental disorder causing hallucinations, delusions and disorganized thinking.",Regular routine · Family support · Avoid drugs and alcohol · Safe environment,Atypical antipsychotics · Typical antipsychotics · Mood stabilizers · Clozapine,"Acute psychosis, self-harm risk, or inability to care for self",severe
endocarditis,Infection of heart valve lining by bacteria causing fever and heart murmur.,Seek emergency care immediately — hospital treatment required,IV antibiotics · Surgical valve replacement · Prolonged antibiotic course,Always requires immediate hospitalization and cardiac evaluation,severe
sepsis,Life-threatening systemic response to infection causing multi-organ dysfunction.,Seek emergency care immediately,IV antibiotics · IV fluids · Vasopressors · Oxygen · ICU supportive care,Immediately — sepsis is a life-threatening medical emergency,severe
heat stroke,Severe heat illness with core temperature above 40°C causing organ damage.,Move to cool area immediately · Remove clothing · Cool wet cloths · Ice packs to groin,IV fluids · Cooling measures · Oxygen · ICU monitoring · Anti-seizure if needed,Any suspected heat stroke — call emergency services immediately,severe
cholecystitis,Gallbladder inflammation usually from gallstones causing severe right upper abdominal pain.,Nil by mouth · Rest · Hydration · Low fat diet on recovery,Antibiotics · Analgesics · IV fluids · Laparoscopic cholecystectomy,"Severe abdominal pain, fever, jaundice, or rigid abdomen",severe
cardiac arrest,Sudden loss of heart function requiring immediate CPR and defibrillation.,Seek emergency care immediately — call 112 · Start CPR immediately,CPR · Defibrillation · Epinephrine · Amiodarone · ICU post-arrest care,Immediately — cardiac arrest is fatal without immediate intervention,severe
cardiomyopathy,Disease of heart muscle causing reduced pumping function and heart failure.,Low sodium diet · Fluid restriction · Avoid alcohol · Regular monitoring,ACE inhibitors · Beta blockers · Diuretics · ICD · Heart transplant if severe,"Breathlessness at rest, ankle swelling, or fainting",severe
meningitis,Inflammation of membranes surrounding brain and spinal cord often from infection.,Seek emergency care immediately,IV antibiotics · Antiviral medications · Corticosteroids · ICU supportive care,Immediately — meningitis is a life-threatening emergency requiring hospitalization,severe
raynaud disease,Exaggerated vascular response to cold or stress causing finger color changes.,Warm gloves · Avoid cold exposure · Quit smoking · Stress management · Exercise,Calcium channel blockers · Vasodilators · Aspirin · Topical nitrates,"Skin ulcers, digital gangrene, or associated autoimmune disease",mild
scabies,Skin infestation by mites causing intense itching especially at night.,Wash all clothing and bedding in hot water · Treat all household members · Vacuum furniture,Permethrin cream · Ivermectin · Antihistamines for itch · Antibiotics if secondary infection,If entire household affected or secondary bacterial infection develops,mild
high blood pressure,Persistently elevated blood pressure increasing risk of heart disease and stroke.,Low sodium diet · Regular exercise · Stress reduction · Reduce alcohol · DASH diet,ACE inhibitors · ARBs · Calcium channel blockers · Diuretics · Beta blockers,BP consistently above 160/100 or sudden severe headache with vision changes,moderate
pelvic inflammatory disease,Infection of female reproductive organs causing pelvic pain and discharge.,Rest · Hydration · Complete full antibiotic course · Avoid intercourse during treatment,Antibiotics (combination) · Analgesics · Partner treatment · Hospitalization if severe,"Fever, severe pain, vomiting, or suspected abscess",moderate
liver disease,Broad term for conditions causing liver damage and impaired liver function.,Avoid alcohol completely · Low fat diet · Adequate protein · Avoid hepatotoxic drugs,Depends on cause — antivirals · Corticosteroids · Diuretics · Liver transplant,"Jaundice, swollen abdomen, confusion, or vomiting blood",severe
chronic constipation,Infrequent difficult bowel movements persisting for more than 3 months.,High fiber diet · Plenty of water · Regular exercise · Prune juice · Respond to urge promptly,Laxatives · Stool softeners · Osmotic agents · Prokinetics · Biofeedback therapy,"Blood in stool, weight loss, new onset after age 50, or severe abdominal pain",mild
thyroid cancer,Malignant tumor of thyroid gland usually presenting as painless neck lump.,Seek specialist care immediately — regular monitoring after treatment,Surgical thyroidectomy · Radioactive iodine · Levothyroxine · External radiation,Always requires immediate endocrinology and oncology specialist evaluation,severe
flu,"Contagious viral respiratory infection causing fever, body aches and fatigue.",Rest · Hydration · Steam inhalation · Ginger tea · Honey lemon water,Paracetamol · Oseltamivir · Decongestants · Antihistamines,"Fever lasting more than 3 days, breathing difficulty, or severe weakness",mild
sprain or strain,Injury to ligament or muscle from overstretching causing pain and swelling.,RICE — Rest Ice Compress Elevate · Gentle movement after 48 hours · Turmeric paste,NSAIDs · Topical analgesics · Muscle relaxants · Physiotherapy,"Severe pain, inability to bear weight, or suspected fracture",mild
appendicitis,Inflammation of appendix causing severe right lower abdominal pain — emergency.,Seek emergency care immediately — do not use home remedies,IV antibiotics · Surgical appendectomy — emergency procedure,Any suspicion of appendicitis is a medical emergency,severe
graves disease,"Autoimmune hyperthyroidism causing enlarged thyroid, rapid heartbeat and eye problems.",Avoid iodine-rich foods · Stress management · Regular monitoring · Selenium foods,Antithyroid drugs · Beta blockers · Radioactive iodine · Thyroidectomy,"Thyroid storm, severe eye disease, or uncontrolled hyperthyroidism",severe
pregnancy,Normal physiological state of carrying developing fetus requiring regular monitoring.,Folic acid · Regular antenatal visits · Adequate nutrition · Rest · Exercise as tolerated,Folic acid · Iron · Calcium · Prenatal vitamins · Treat complications as needed,"Heavy bleeding, severe pain, reduced fetal movement, or hypertension",mild
septic arthritis,"Joint infection causing severe pain, swelling, warmth and fever.",Seek emergency care immediately — joint drainage required,IV antibiotics · Surgical joint washout · Analgesics · Physiotherapy after resolution,Immediately — septic arthritis can permanently destroy joint without treatment,severe
urinary tract infection,"Bacterial infection causing burning urination, frequency and pelvic discomfort.",Cranberry juice · Increased water intake · Avoid irritants · Heat pad on abdomen,Antibiotics · Urinary alkalizers · Analgesics · Probiotics during treatment,"Fever with chills, back pain, or symptoms persisting beyond 3 days",moderate
scoliosis,Lateral curvature of spine causing uneven shoulders and waist.,Posture awareness · Back strengthening exercises · Swimming · Regular monitoring,Bracing · Physical therapy · Surgical spinal fusion for severe curves,"Rapid curve progression, back pain, breathing difficulty, or neurological symptoms",moderate
epilepsy,Neurological disorder causing recurrent unprovoked seizures from abnormal brain activity.,Regular sleep · Avoid alcohol and flashing lights · Stress management · Seizure diary,Valproate · Levetiracetam · Lamotrigine · Phenytoin · Carbamazepine,"Seizure lasting over 5 minutes, injury, or new onset seizures",severe
prostate cancer,Malignant tumor of prostate gland often slow growing but potentially aggressive.,Seek specialist care immediately — healthy diet · Regular monitoring of PSA,Surgery (prostatectomy) · Radiation · Hormone therapy · Chemotherapy · Immunotherapy,Always requires immediate urology oncology specialist evaluation,severe
chronic pancreatitis,Long-term pancreatic inflammation causing persistent pain and malabsorption.,Avoid alcohol completely · Low fat diet · Small frequent meals · Adequate hydration,Pancreatic enzyme supplements · Analgesics · Fat-soluble vitamins · Insulin if needed,"Severe pain, weight loss, diabetes onset, or suspected pancreatic cancer",severe
burn,"Tissue damage from heat, chemicals or radiation requiring wound care.",Cool running water for 20 minutes · Cover with clean cloth · Do not use ice or butter,Analgesics · Topical silver sulfadiazine · Antibiotics · IV fluids · Skin grafting,"Burns larger than palm, facial burns, electrical burns, or chemical burns",moderate
genital herpes,Sexually transmitted viral infection causing painful genital blisters.,Warm sitz bath · Loose clothing · Avoid sexual contact during outbreak · Stress management,Acyclovir · Valacyclovir · Famciclovir · Suppressive therapy for frequent outbreaks,"Frequent recurrences, complications in pregnancy, or severe first episode",moderate
