disease,description,home_remedies,medicine_category,consult_if,severity
gallstone,Hard deposits in gallbladder causing severe right upper abdominal pain after meals.,Low fat diet · Maintain healthy weight · Stay hydrated · Avoid crash dieting,Analgesics · Antispasmodics · Ursodeoxycholic acid · Laparoscopic cholecystectomy,"Severe pain, fever, jaundice, or persistent nausea and vomiting",moderate
multiple sclerosis,Autoimmune disease damaging myelin in CNS causing variable neurological symptoms.,Regular exercise · Vitamin D · Avoid overheating · Stress management · Adequate sleep,Interferon beta · Glatiramer · Natalizumab · Ocrelizumab · Corticosteroids for relapses,"New neurological symptoms, vision loss, or significant disability progression",severe
hyperlipidemia,Elevated blood fats including cholesterol and triglycerides increasing cardiovascular risk.,Low saturated fat diet · Regular exercise · Reduce sugar · Omega-3 foods · Quit smoking,Statins · Fibrates · Omega-3 supplements · Ezetimibe · PCSK9 inhibitors,"Cardiovascular symptoms, pancreatitis risk, or very high triglycerides above 500",moderate
ulcerative colitis,Chronic inflammatory bowel disease causing ulcers in colon and rectum.,Low residue diet during flare · Stress management · Probiotics · Adequate hydration,Aminosalicylates · Corticosteroids · Immunomodulators · Biologics · Surgery,"Blood in stool, severe abdominal pain, fever, or significant weight loss",moderate
angina,Chest pain from reduced coronary blood flow during physical or emotional stress.,Rest immediately · Nitrate under tongue · Cardiac rehabilitation · Heart-healthy diet,Nitrates · Beta blockers · Calcium channel blockers · Aspirin · Revascularization,"Chest pain at rest, prolonged pain, or associated with sweating and nausea",severe
colorectal cancer,Malignant tumor of colon or rectum requiring specialist oncology care.,Seek specialist care immediately — high fiber diet · Regular colonoscopy screening,Surgery · Chemotherapy · Radiation · Targeted therapy · Immunotherapy,Always requires immediate gastroenterology and oncology evaluation,severe
diabetic ketoacidosis,Life-threatening complication of diabetes with very high blood sugar and ketones.,Seek emergency care immediately — do not attempt home management,IV insulin · IV fluids · Potassium replacement · Bicarbonate · ICU monitoring,Immediately — DKA is a life-threatening diabetic emergency,severe
obsessive compulsive disorder (ocd),Mental disorder causing unwanted obsessive thoughts and repetitive compulsive behaviors.,Mindfulness · Delay compulsions · Exposure practice · Regular exercise · Support groups,SSRIs · Clomipramine · CBT with ERP · Augmentation with antipsychotics,Obsessions and compulsions taking more than 1 hour daily or causing severe distress,moderate
hyponatremia,"Low blood sodium causing nausea, headache, confusion and seizures.",Fluid restriction · Salt-containing foods · Seek medical assessment,Hypertonic saline (severe) · Salt tablets · Treat underlying cause · Fluid restriction,"Confusion, seizures, or sodium below 125 mEq/L — emergency treatment needed",severe
bone disorder,"General term for conditions affecting bone density, structure or metabolism.",Weight-bearing exercise · Calcium and vitamin D · Avoid smoking · Fall prevention,Bisphosphonates · Denosumab · Calcium supplements · Vitamin D · Teriparatide,"Fracture with minimal trauma, bone pain at rest, or rapid bone loss",moderate
personality disorder,Enduring patterns of thinking and behavior causing distress and relationship difficulties.,Structured routine · Dialectical behavior therapy · Mindfulness · Social skills training,Mood stabilizers · Antidepressants · Antipsychotics · Psychotherapy,"Self-harm, suicidal ideation, or inability to maintain daily functioning",moderate
shingles (herpes zoster),Reactivation of chickenpox virus causing painful unilateral rash and nerve pain.,Cool compresses · Calamine lotion · Loose clothing · Rest · Avoid scratching,Antiviral medications · Analgesics · Gabapentin · Corticosteroids · Capsaicin cream,"Eye involvement, severe pain, widespread rash, or immunocompromised state",moderate
strep throat,"Bacterial throat infection causing severe sore throat, fever and swollen lymph nodes.",Salt water gargle · Honey lemon tea · Cold fluids · Rest · Throat lozenges,Penicillin · Amoxicillin · Azithromycin · Analgesics · Antipyretics,"No improvement after 48 hours of antibiotics, rash, or difficulty breathing",mild
osteomyelitis,"Bone infection usually bacterial causing severe bone pain, fever and swelling.",Seek medical care promptly · Rest affected limb · Wound care if open,IV antibiotics · Surgical debridement · Hyperbaric oxygen · Bone grafting,"Fever with bone pain, chronic non-healing wound, or diabetic foot infection",severe
viral hepatitis,Liver inflammation from hepatitis viruses causing jaundice and liver dysfunction.,Rest · Avoid alcohol · Nutritious diet · Hydration · Avoid hepatotoxic medications,Antivirals (Hep B and C) · Interferons · Supportive care · Liver transplant if severe,"Jaundice, confusion, bleeding tendency, or known contact with hepatitis case",moderate
gastritis,"Inflammation of stomach lining causing pain, nausea and indigestion.",Small frequent meals · Avoid spicy foods · Ginger tea · Aloe vera juice · No alcohol,Antacids · PPIs · H2 blockers · Antibiotics if H. pylori · Bismuth subsalicylate,"Vomiting blood, black stools, or severe persistent abdominal pain",mild
skin cancer,Malignant tumor of skin cells requiring specialist evaluation and treatment.,Seek specialist care immediately — sun protection · Regular skin checks,Surgical excision · Mohs surgery · Radiation · Immunotherapy · Targeted therapy,"Any changing mole, non-healing sore, or suspicious skin lesion",severe
tonsillitis,"Inflammation of tonsils causing severe sore throat, fever and difficulty swallowing.",Warm salt water gargle · Cold ice cream · Rest · Honey · Adequate fluids,Antibiotics · Analgesics · Antipyretics · Throat lozenges · Tonsillectomy if recurrent,"Difficulty breathing, drooling, muffled voice, or symptoms over 10 days",mild
stomach cancer,Malignant tumor of stomach wall requiring specialist oncology management.,Seek specialist care immediately — nutritional support · Small frequent meals,Surgery · Chemotherapy · Radiation · Targeted therapy (trastuzumab) · Palliative care,Always requires immediate gastroenterology and oncology evaluation,severe
delirium,Acute confused state with fluctuating consciousness and disorientation.,Safe environment · Reorientation · Adequate lighting · Maintain sleep cycle · Hydration,Treat underlying cause · Haloperidol · Quetiapine · Avoid sedatives · Thiamine,Any acute onset confusion in elderly especially with fever or medication change,severe
guillain barre syndrome,Autoimmune disorder damaging peripheral nerves causing ascending paralysis.,Seek emergency care immediately — monitor breathing closely,IVIG · Plasmapheresis · Supportive ventilation · Physiotherapy · Pain management,Any ascending weakness or breathing difficulty — immediate hospitalization,severe
lumbago,"Lower back pain from muscle strain, disc problems or postural issues.",Rest · Hot or cold therapy · Gentle stretching · Posture correction · McKenzie exercises,NSAIDs · Muscle relaxants · Analgesics · Physiotherapy · Epidural steroid injection,"Leg numbness, bladder or bowel changes, or pain from injury or cancer",mild
peripheral arterial disease,Narrowed peripheral arteries reducing blood flow to limbs causing leg pain.,Regular walking · Quit smoking · Foot care · Heart-healthy diet · Wound care,Antiplatelets · Statins · Cilostazol · Revascularization · Wound care,"Non-healing foot ulcer, gangrene, or rest pain in leg",severe
chronic back pain,Back pain persisting more than 3 months significantly affecting quality of life.,Gentle yoga · Swimming · Heat therapy · Posture exercises · Weight management,NSAIDs · Muscle relaxants · Antidepressants · Epidural steroids · Physiotherapy,"Leg weakness, bladder or bowel involvement, or fever with back pain",moderate
heart failure,Heart unable to pump sufficient blood causing breathlessness and fluid retention.,Low sodium diet · Fluid restriction · Daily weighing · Gentle exercise · Elevation,ACE inhibitors · Beta blockers · Diuretics · Spironolactone · SGLT2 inhibitors,"Sudden breathlessness, weight gain of 2kg in 2 days, or ankle swelling",severe
conjunctivitis,Inflammation of conjunctiva causing red watery or sticky eyes.,Warm compress · Saline eye wash · Avoid touching eyes · Separate towels,Antibiotic eye drops · Antihistamine drops · Lubricant drops · Steroid drops,"Vision changes, severe pain, or no improvement after 5 days",mild
herniated disk,Disc material pressing on spinal nerve causing back and leg pain.,Gentle walking · Ice or heat · Anti-inflammatory diet · Avoid lifting · Posture care,NSAIDs · Muscle relaxants · Epidural steroids · Physiotherapy · Surgery if severe,"Bladder or bowel dysfunction, progressive weakness, or severe uncontrolled pain",moderate
pulmonary embolism,Blood clot in pulmonary artery blocking blood flow to lung — emergency.,Seek emergency care immediately,Anticoagulants · Thrombolytics (massive PE) · Oxygen · IVC filter · Surgery,Immediately — pulmonary embolism can be rapidly fatal,severe
melanoma,Aggressive skin cancer from melanocytes requiring immediate specialist care.,Seek specialist care immediately — sun protection · Regular skin checks,Wide local excision · Sentinel node biopsy · Immunotherapy · Targeted therapy,Any suspicious changing darkening mole or new pigmented lesion,severe
laryngitis,"Inflammation of larynx causing hoarseness, loss of voice and throat discomfort.",Voice rest · Stay hydrated · Steam inhalation · Honey · Avoid whispering,Analgesics · Corticosteroids (short course) · Antibiotics if bacterial · Antireflux therapy,"Hoarseness lasting more than 2 weeks, breathing difficulty, or coughing blood",mild
eczema,Chronic inflammatory skin condition causing itchy dry and red patches.,Moisturize frequently · Avoid triggers · Short lukewarm baths · Oatmeal bath · Cotton clothing,Topical corticosteroids · Antihistamines · Calcineurin inhibitors · Dupilumab,"Skin infection, widespread rash, or severe sleep disruption from itching",mild
gastroduodenal ulcer,Open sore in stomach or duodenum lining causing burning epigastric pain.,Avoid NSAIDs and alcohol · Small meals · No spicy foods · Probiotics · Stress reduction,PPIs · H2 blockers · Antibiotics for H. pylori · Bismuth · Antacids,"Vomiting blood, black tarry stools, severe pain, or unexplained weight loss",moderate
inguinal hernia,Tissue protrudes through weak spot in abdominal muscles near groin.,Avoid heavy lifting · Weight management · High fiber diet to prevent straining,Pain relievers · Surgical hernioplasty (definitive treatment) · Truss belt,"Sudden severe pain, non-reducible hernia, or signs of bowel obstruction",moderate
paronychia,Infection of skin around fingernail or toenail causing redness and pus.,Warm water soaks 3-4 times daily · Keep area clean and dry · Avoid nail biting,Antibiotics · Antifungals · Incision and drainage · Partial nail removal if severe,"Spreading redness, fever, or abscess formation not improving with home care",mild
mucositis,Inflammation and ulceration of mucous membranes often from chemotherapy.,Gentle saline rinse · Soft foods · Cool liquids · Good oral hygiene · Avoid irritants,Analgesics · Topical anesthetics · Antifungals if oral thrush · Growth factors,"Inability to eat or drink, severe pain, or signs of oral infection",moderate
spondylolisthesis,One vertebra slips forward over the one below causing back and leg pain.,Core strengthening exercises · Physical therapy · Weight management · Avoid impact sports,NSAIDs · Analgesics · Physiotherapy · Epidural steroids · Surgical fusion,"Leg weakness, bladder or bowel symptoms, or progressive slippage on imaging",moderate
kaposi sarcoma,Malignant tumor of blood vessel walls often associated with HIV infection.,Seek specialist care immediately — antiretroviral therapy for HIV-associated KS,Antiretrovirals · Chemotherapy · Radiation · Immunotherapy · Targeted therapy,Always requires immediate oncology and infectious disease specialist evaluation,severe
conjunctivitis due to virus,"Viral eye infection causing redness, watery discharge and irritation.",Warm compress · Saline eye rinse · Avoid touching eyes · Separate towels and pillowcase,Lubricant eye drops · Antiviral drops if herpes · Symptomatic treatment only,"Vision changes, corneal involvement, or symptoms beyond 2 weeks",mild
anemia,"Reduced red blood cells or hemoglobin causing fatigue, pallor and weakness.",Iron-rich foods · Vitamin C with iron foods · Folate-rich greens · Beetroot juice · Dates,Iron supplements · Folic acid · Vitamin B12 · Erythropoietin · Transfusion if severe,"Hemoglobin below 7 g/dL, chest pain, or breathlessness at rest",moderate
tendinitis,Inflammation of tendon causing localized pain and tenderness near a joint.,RICE — Rest Ice Compress Elevate · Gentle stretching · Eccentric exercises · Avoid overuse,NSAIDs · Corticosteroid injection · PRP therapy · Physiotherapy · Surgery if chronic,"Severe pain, complete tendon rupture, or no improvement after 3 months",mild
common cold,"Mild viral upper respiratory infection causing runny nose, sneezing and mild symptoms.",Steam inhalation · Warm fluids · Rest · Turmeric milk · Saline nasal drops · Honey,Antihistamines · Decongestants · Analgesics · Zinc lozenges · Vitamin C,"Symptoms persisting beyond 10 days, worsening, or associated high fever",mild
amyotrophic lateral sclerosis (als),Progressive neurodegenerative disease affecting motor neurons causing muscle weakness.,Physical therapy · Assistive devices · Nutritional support · Speech therapy · Palliative care,Riluzole · Edaravone · Symptomatic medications · Respiratory support,Always requires immediate neurology specialist for diagnosis and management,severe
venous insufficiency,"Inadequate venous return from legs causing swelling, skin changes and ulcers.",Elevate legs · Compression stockings · Regular walking · Weight management,Compression therapy · Diuretics · Wound care · Venous ablation · Surgery,"Non-healing leg ulcer, severe swelling, or skin breakdown",moderate
diabetes insipidus,Rare condition causing extreme thirst and large amounts of dilute urine.,Adequate fluid intake · Monitor fluid balance · Salt-restricted diet,Desmopressin · Thiazide diuretics (nephrogenic) · Indomethacin · Treat underlying cause,"Severe dehydration, electrolyte imbalance, or loss of consciousness",moderate
varicocele of the testicles,Enlargement of veins in scrotum causing dull ache and possibly affecting fertility.,Supportive underwear · Avoid prolonged standing · Semen analysis monitoring,Surgical varicocelectomy · Percutaneous embolization · Analgesics for pain,"Significant pain, testicular atrophy, or infertility evaluation needed",mild
fracture of the foot,"Broken bone in foot causing severe pain, swelling and inability to bear weight.",RICE — Rest Ice Compress Elevate · Immobilize foot · No weight bearing,Analgesics · Casting · Surgical fixation (displaced) · Physiotherapy,Always requires X-ray and orthopedic evaluation,moderate
thyroid nodule,Abnormal growth in thyroid gland requiring evaluation to rule out malignancy.,Regular monitoring · Adequate iodine intake · Thyroid function monitoring,Levothyroxine suppression · Radioactive iodine · Surgical excision if malignant,"Rapid growth, voice change, difficulty swallowing, or suspicious features on ultrasound",mild
lymphadenitis,"Inflammation of lymph nodes causing swelling, tenderness and sometimes fever.",Warm compress · Rest · Adequate hydration · Treat underlying infection,Antibiotics · Analgesics · Antivirals if viral cause · Surgical drainage if abscess,"Rapidly enlarging node, hard fixed node, or persistent beyond 4 weeks",moderate
aortic valve disease,Dysfunction of aortic valve causing stenosis or regurgitation affecting heart function.,Regular cardiac monitoring · Low sodium diet · Avoid strenuous exertion,Diuretics · ACE inhibitors · Beta blockers · Surgical valve replacement or TAVR,"Chest pain, fainting, breathlessness on exertion, or rapid symptom progression",severe
anal fistula,Abnormal tunnel between anal canal and skin causing pain and discharge.,Sitz bath · High fiber diet · Adequate fluids · Good hygiene · Manage Crohn disease,Antibiotics · Surgical fistulotomy · Seton placement · Biological therapy for Crohn,"Increasing pain, fever, or abscess formation",moderate
hypothermia,Dangerously low core body temperature below 35°C from cold exposure.,Move to warm area · Remove wet clothing · Wrap in blankets · Warm sweet drinks,IV warm fluids · Warm humidified oxygen · Cardiac monitoring · Rewarming techniques,"Core temperature below 35°C, confusion, or loss of consciousness",severe
iron deficiency anemia,Low iron stores causing inadequate red blood cell production and fatigue.,Red meat · Leafy greens · Legumes · Vitamin C to enhance iron absorption · Cook in iron pans,Ferrous sulfate · Iron polymaltose · IV iron (severe) · Folic acid · Treat underlying cause,"Hemoglobin below 8 g/dL, heart palpitations, or dizziness on standing",moderate
hypokalemia,"Low blood potassium causing muscle weakness, cramps and heart arrhythmias.",Potassium-rich foods — bananas · oranges · potatoes · spinach · Adequate hydration,Oral potassium supplements · IV potassium (severe) · Treat underlying cause,"Muscle paralysis, cardiac arrhythmia, or severe weakness",moderate
decubitus ulcer,Pressure sore from prolonged pressure on skin over bony prominences.,Regular repositioning every 2 hours · Pressure-relief mattress · Nutritional support · Skin care,Wound dressings · Debridement · Antibiotics if infected · Surgical reconstruction,"Deep wounds, exposed bone, or wound infection with systemic signs",moderate
sensorineural hearing loss,Permanent inner ear or auditory nerve damage causing partial or complete deafness.,Protect ears from loud noise · Manage underlying conditions · Hearing aid fitting,Hearing aids · Cochlear implant · Corticosteroids (sudden onset) · Treat underlying cause,Sudden hearing loss requires emergency audiological evaluation within 72 hours,moderate
urge incontinence,Sudden strong urge to urinate followed by involuntary urine leakage.,Bladder training · Pelvic floor exercises · Limit caffeine and alcohol · Timed voiding,Anticholinergics · Beta-3 agonists · Botulinum toxin injection · Sacral neuromodulation,Significantly affecting quality of life or associated with blood in urine,mild
vitamin a deficiency,"Insufficient vitamin A causing night blindness, dry eyes and immune weakness.",Orange and yellow vegetables · Dark leafy greens · Liver · Dairy · Eggs,Vitamin A supplementation · Multivitamins · Treat underlying malabsorption,"Night blindness, corneal ulceration, or frequent infections in children",moderate
fracture of the rib,Broken rib causing sharp chest pain worsened by breathing or movement.,Rest · Breathing exercises · Ice pack · Hold pillow against chest when coughing,Analgesics · NSAIDs · Intercostal nerve block · Surgery only if multiple unstable fractures,"Breathing difficulty, suspected pneumothorax, or multiple rib fractures",moderate
alcohol abuse,Pattern of harmful alcohol use causing physical and psychological dependence.,Reduce drinking gradually · Support groups · Healthy diet · Exercise · Counseling,Naltrexone · Acamprosate · Disulfiram · Benzodiazepines · Thiamine supplementation,"Withdrawal symptoms, liver disease, or complete inability to stop drinking",moderate
retinal detachment,Separation of retina from underlying tissue causing vision loss — emergency.,Seek emergency care immediately — sudden vision changes are an emergency,Surgical reattachment · Laser photocoagulation · Cryotherapy · Pneumatic retinopexy,"Immediately — any sudden flashes, floaters, or curtain over vision",severe
dental caries,Tooth decay from bacterial acid erosion of enamel causing pain and cavities.,Brush twice daily · Floss daily · Reduce sugar · Fluoride toothpaste · Regular dental visits,Dental fillings · Root canal · Crown · Tooth extraction · Fluoride treatment,"Severe pain, facial swelling, or fever associated with toothache",mild
polycythemia vera,Bone marrow disorder producing too many red blood cells increasing clot risk.,Adequate hydration · Avoid iron supplements · Regular phlebotomy as directed,Phlebotomy · Hydroxyurea · Aspirin · Ruxolitinib · Interferon-alpha,"Stroke symptoms, blood clot, or blood count becoming very high",severe
folate deficiency,Insufficient folic acid causing megaloblastic anemia and neural tube defects.,Dark leafy greens · Legumes · Citrus fruits · Fortified cereals · Avocado,Folic acid supplements · Folinic acid · Treat underlying malabsorption,"Pregnancy planning, known malabsorption, or hemoglobin falling",mild
atrial flutter,Regular but very fast atrial rhythm causing palpitations and reduced cardiac output.,Avoid caffeine and alcohol · Regular monitoring · Stress reduction · Adequate sleep,Beta blockers · Calcium channel blockers · Anticoagulants · Cardioversion · Ablation,"Chest pain, fainting, breathlessness, or rapid worsening symptoms",severe
tooth disorder,"General dental problems including decay, fracture, and sensitivity.",Brush twice daily · Fluoride toothpaste · Avoid hard foods · Dental wax for sharp edges,Analgesics · Dental fillings · Crown · Extraction · Desensitizing toothpaste,"Severe pain, swelling, fever, or trauma to the jaw",mild
heart attack,Coronary artery blockage causing heart muscle death — life-threatening emergency.,Seek emergency care immediately — call 112 or ambulance immediately,Thrombolytics · Aspirin · Anticoagulants · PCI intervention · Beta blockers,Immediately — this is a life-threatening emergency requiring ambulance,severe
oral thrush (yeast infection),Fungal infection of mouth causing white patches and soreness.,Maintain oral hygiene · Rinse mouth after inhaled steroids · Probiotics · Limit sugar,Clotrimazole troches · Oral fluconazole · Nystatin suspension · Treat underlying cause,"Difficulty swallowing, spreading to throat, or immunocompromised state",mild
orthostatic hypotension,Blood pressure drop on standing causing dizziness and fainting.,Rise slowly from sitting or lying · Increase fluid and salt intake · Compression stockings,Fludrocortisone · Midodrine · Pyridostigmine · Reduce antihypertensive dosage,"Frequent falls, fainting, or associated with neurological symptoms",moderate
obstructive sleep apnea (osa),Repeated upper airway collapse during sleep causing snoring and oxygen drops.,Weight loss · Sleep on side · Elevate head of bed · Avoid alcohol and sedatives,CPAP therapy · Oral mandibular device · Positional therapy · Surgery for anatomical causes,"Excessive daytime sleepiness, witnessed apneas, or morning headaches",moderate
arthritis of the hip,Inflammation or degeneration of hip joint causing pain and restricted movement.,Low-impact exercise · Weight management · Heat or ice therapy · Walking aids,NSAIDs · Analgesics · Corticosteroid injections · Physiotherapy · Hip replacement,"Severe pain limiting walking, night pain, or significant mobility loss",moderate
testicular torsion,Twisting of spermatic cord cutting off blood supply — urological emergency.,Seek emergency care immediately — do not delay for any reason,Emergency surgical detorsion — within 6 hours to save testicle,Immediately — testicular torsion requires emergency surgery within hours,severe
pain disorder affecting the neck,"Persistent neck pain from muscle tension, disc disease or nerve compression.",Neck stretches · Heat or ice · Good posture · Ergonomic workstation · Pillow adjustment,NSAIDs · Muscle relaxants · Physiotherapy · Cervical collar · Nerve block,"Arm weakness, numbness, or inability to control bladder or bowel",mild
acute bronchiolitis,Viral lower respiratory infection in infants causing wheezing and breathing difficulty.,Saline nasal drops · Upright positioning · Small frequent feeds · Humidified air,Oxygen therapy · Bronchodilators · IV fluids · Hypertonic saline nebulization,"Severe respiratory distress, oxygen below 92%, or poor feeding in infant",moderate
dementia,"Progressive cognitive decline affecting memory, thinking and daily functioning.",Mental stimulation · Physical exercise · Social engagement · Structured routine · Safety measures,Donepezil · Memantine · Rivastigmine · Antidepressants · Antipsychotics if needed,"Rapid cognitive decline, behavioral changes, or safety concerns",severe
insect bite,"Skin reaction to insect sting or bite causing local pain, itching and swelling.",Wash with soap and water · Ice pack · Elevate limb · Remove stinger · Baking soda paste,Antihistamines · Topical hydrocortisone · Calamine lotion · Epinephrine if anaphylaxis,"Anaphylaxis symptoms, rapidly spreading redness, or bite from venomous insect",mild
congenital heart defect,Structural heart abnormality present from birth affecting circulation.,Regular cardiac follow-up · Healthy diet · Activity as tolerated · Endocarditis prophylaxis,Depends on defect — surgery · Catheter intervention · Medications · Monitoring,"Breathlessness, cyanosis, poor weight gain, or symptoms in child with known defect",severe
